
Código Contable;Descripción;Moneda chilena no reajustable;Moneda chilena reajustable por factores de IPC;Moneda chilena reajustables por tipo de cambio;Moneda Extranjera;Total (suma de todas las monedas)
 
4100000;INGRESOS POR INTERESES Y REAJUSTES;409.360;359.109;575;489.745;1.258.789
4100100;Contratos de retrocompra;1.899;0;0;1.592;3.491
4100101;Intereses;1.899;0;0;1.592;3.491
4100151;Reajustes;0;0;0;0;0
4100200;Créditos otorgados a bancos;2.068;0;0;1.274;3.342
4100201;Intereses;2.068;0;0;1.274;3.342
4100251;Reajustes;0;0;0;0;0
4100300;Colocaciones comerciales;228.720;154.563;376;282.198;665.857
4100301;Intereses de préstamos comerciales;192.862;40.500;0;197.373;430.735
4100309;Intereses de créditos de comercio exterior;4.542;0;0;40.054;44.596
4100310;Intereses de créditos en cuentas corrientes;15.758;0;0;2.281;18.039
4100320;Intereses de operaciones de factoraje;4.606;3;0;2.488;7.097
4100325;Intereses de préstamos estudiantiles;4;22.272;0;0;22.276
4100330;Intereses por leasing comercial;8.546;9.289;0;36.397;54.232
4100340;Intereses de otros créditos y cuentas por cobrar;0;10;0;3.496;3.506
4100351;Reajustes de préstamos comerciales;0;59.841;0;0;59.841
4100359;Reajustes de créditos de comercio exterior;0;0;0;0;0
4100360;Reajustes de créditos en cuentas corrientes;0;0;0;0;0
4100370;Reajustes de operaciones de factoraje;0;69;0;0;69
4100375;Reajustes de préstamos estudiantiles;0;15.793;0;0;15.793
4100380;Reajustes por leasing comercial;0;6.071;376;0;6.447
4100390;Reajustes de otros créditos y cuentas por cobrar;0;113;0;0;113
4100399;Comisiones por prepago de créditos comerciales;2.402;602;0;109;3.113
4100400;Colocaciones para vivienda;0;179.121;0;40.057;219.178
4100401;Intereses de préstamos con letras de crédito;0;1.477;0;0;1.477
4100402;Comisiones de préstamos con letras de crédito;0;767;0;0;767
4100403;Intereses de prestamos con mutuos financiados con bonos hipotecarios;0;0;0;0;0
4100405;Intereses de préstamos con MHE;0;4.610;0;0;4.610
4100407;Intereses de otros mutuos para vivienda;0;94.545;0;17.496;112.041
4100408;Intereses de créditos ANAP;0;0;0;0;0
4100420;Intereses por leasing para vivienda;0;1;0;22.561;22.562
4100430;Intereses de otros créditos para vivienda;0;881;0;0;881
4100451;Reajustes de préstamos con letras de crédito;0;881;0;0;881
4100452;Reajustes de prestamos con mutuos financiados con bonos hipotecarios;0;0;0;0;0
4100455;Reajustes de préstamos con MHE;0;2.706;0;0;2.706
4100457;Reajustes de otros mutuos para vivienda;0;72.078;0;0;72.078
4100458;Reajustes de créditos ANAP;0;0;0;0;0
4100480;Reajustes por leasing para vivienda;0;0;0;0;0
4100490;Reajustes de otros créditos para vivienda;0;502;0;0;502
4100499;Comisiones por prepago de créditos para vivienda;0;673;0;0;673
4100500;Colocaciones de consumo;167.807;756;0;109.720;278.283
4100501;Intereses de créditos de consumo en cuotas;100.291;211;0;89.255;189.757
4100510;Intereses de créditos en cuentas corrientes;36.663;0;0;638;37.301
4100520;Intereses de créditos por tarjetas de crédito;28.951;0;0;18.663;47.614
4100530;Intereses por leasing de consumo;36;4;0;804;844
4100540;Intereses de otros créditos de consumo;1;0;0;360;361
4100590;Reajustes colocaciones de consumo;0;541;0;0;541
4100599;Comisiones por prepago de créditos de consumo;1.865;0;0;0;1.865
4100600;Instrumentos de inversión;23.722;19.897;199;49.148;92.966
4100601;Intereses de inversiones disponibles para la venta;23.722;5.649;199;44.184;73.754
4100621;Intereses de inversiones hasta el vencimiento;0;0;0;4.964;4.964
4100651;Reajustes de inversiones disponibles para la venta;0;14.248;0;0;14.248
4100671;Reajustes de inversiones hasta el vencimiento;0;0;0;0;0
4100800;Otros ingresos por intereses o reajustes;1.373;4.772;0;5.756;11.901
4100801;Intereses por saldos en cuentas corrientes;0;0;0;0;0
4100804;Intereses operaciones overnight;0;0;0;1.329;1.329
4100810;Otros intereses ganados;1.373;0;0;4.427;5.800
4100850;Otros reajustes ganados;0;4.772;0;0;4.772
4100900;Resultado de coberturas contables;-16.229;0;0;0;-16.229
4150000;GASTOS POR INTERESES Y REAJUSTES;-193.192;-188.055;0;-257.043;-638.290
4150100;Depósitos a la vista;-4.250;-113;0;-32.882;-37.245
4150101;Intereses por cuentas corrientes;-4.250;0;0;-788;-5.038
4150102;Intereses por otros depósitos y cuentas a la vista;0;0;0;-32.094;-32.094
4150103;Intereses por otras obligaciones a la vista;0;0;0;0;0
4150151;Reajustes por obligaciones a la vista;0;-113;0;0;-113
4150200;Contratos de retrocompra;-5.349;-3;0;-15.671;-21.023
4150201;Intereses;-5.349;0;0;-15.671;-21.020
4150251;Reajustes;0;-3;0;0;-3
4150300;Depósitos y captaciones a plazo;-141.444;-28.412;0;-123.218;-293.074
4150301;Intereses por depósitos a plazo;-141.434;-16.504;0;-123.026;-280.964
4150302;Intereses por cuentas de ahorro a plazo;-10;0;0;-192;-202
4150309;Intereses de otros saldos acreedores a plazo;0;0;0;0;0
4150351;Reajustes por depósitos a plazo;0;-11.751;0;0;-11.751
4150352;Reajustes por cuentas de ahorro a plazo;0;-157;0;0;-157
4150359;Reajustes de otros saldos acreedores a plazo;0;0;0;0;0
4150400;Obligaciones con bancos;-1.569;-322;0;-48.947;-50.838
4150401;Intereses;-1.569;-157;0;-48.947;-50.673
4150451;Reajustes;0;-165;0;0;-165
4150500;Instrumentos de deuda emitidos;-46.280;-155.910;0;-35.518;-237.708
4150501;Intereses por letras de crédito;0;-1.103;0;0;-1.103
4150511;Intereses por bonos corrientes;-46.280;-39.789;0;-35.518;-121.587
4150521;Intereses por bonos subordinados;0;-25.673;0;0;-25.673
4150522;Intereses por bonos hipotecarios;0;0;0;0;0
4150551;Reajustes por letras de crédito;0;-1.174;0;0;-1.174
4150561;Reajustes por bonos corrientes;0;-71.709;0;0;-71.709
4150571;Reajustes por bonos subordinados;0;-16.462;0;0;-16.462
4150572;Reajustes por bonos hipotecarios;0;0;0;0;0
4150600;Otras obligaciones financieras;0;0;0;-413;-413
4150601;Intereses;0;0;0;-413;-413
4150651;Reajustes;0;0;0;0;0
4150800;Otros gastos por intereses o reajustes;0;-3.295;0;-394;-3.689
4150801;Intereses;0;0;0;-394;-394
4150851;Reajustes;0;-3.295;0;0;-3.295
4150900;Resultado de coberturas contables;5.700;0;0;0;5.700
4200000;INGRESOS POR COMISIONES;116.556;1.539;0;55.429;173.524
4200100;Comisiones por líneas de crédito y sobregiros;4.134;0;0;704;4.838
4200200;Comisiones por avales y cartas de crédito;5.661;1.539;0;3.855;11.055
4200300;Comisiones por servicios de tarjetas;35.266;0;0;19.048;54.314
4200303;Tarjetas de cajeros automáticos;9.005;0;0;2.326;11.331
4200304;Tarjetas de crédito-comisiones a titulares;6.596;0;0;2.013;8.609
4200305;Tarjetas de crédito-comisiones de establecimientos;10.435;0;0;13.128;23.563
4200306;Tarjetas de débito-comisiones de titulares;5.375;0;0;169;5.544
4200307;Tarjetas de débito-comisiones de establecimientos;3.855;0;0;0;3.855
4200309;Otras tarjetas;0;0;0;1.412;1.412
4200400;Comisiones por administración de cuentas;5.621;0;0;2.380;8.001
4200500;Comisiones por cobranzas, recaudaciones y pagos;9.777;0;0;5.848;15.625
4200600;Comisiones por intermediación y manejo de valores;3.123;0;0;5.776;8.899
4200700;Comisiones por inversiones en fondos mutuos u otros;11.556;0;0;6.934;18.490
4200800;Remuneraciones por comercialización de seguros;24.341;0;0;3.259;27.600
4200900;Otras comisiones ganadas;17.077;0;0;7.625;24.702
4250000;GASTOS POR COMISIONES;-11.099;0;0;-25.968;-37.067
4250100;Remuneraciones por operación de tarjetas;-8.403;0;0;-17.732;-26.135
4250101;Comisiones por operación de tarjetas de crédito;-3.395;0;0;-17.686;-21.081
4250102;Comisiones por operación de tarjetas de débito y cajeros;-5.008;0;0;-46;-5.054
4250190;Otras;0;0;0;0;0
4250200;Comisiones por operación con valores;-1.102;0;0;-1.246;-2.348
4250300;Otras comisiones;-1.594;0;0;-6.990;-8.584
4300000;UTILIDAD NETA DE OPERACIONES FINANCIERAS;93.224;-5.895;0;35.743;123.072
4300100;Instrumentos financieros para negociación;2.399;0;0;-3.604;-1.205
4300101;Intereses y reajustes;1.689;0;0;11.879;13.568
4300102;Ajuste a valor razonable;-56;0;0;-14.451;-14.507
4300103;Utilidad por venta;1.800;0;0;1.191;2.991
4300104;Pérdida por venta;-1.138;0;0;-2.223;-3.361
4300190;Resultado inversiones en Fondos Mutuos;104;0;0;0;104
4300200;Derivados de negociación;75.102;-5.895;0;25.899;95.106
4300300;Venta de instrumentos disponibles para la venta;9.917;0;0;4.006;13.923
4300400;Venta de cartera de créditos;2.378;0;0;8.142;10.520
4300500;Resultado neto de otras operaciones;3.428;0;0;1.300;4.728
4350000;UTILIDAD (PÉRDIDA) DE CAMBIO NETA;-8.077;161;-323;7.196;-1.043
4350100;Resultado neto de cambio monedas extranjeras;-25.502;0;0;7.193;-18.309
4350200;Resultados neto por reajustes por tipo de cambio;0;161;-323;0;-162
4350900;Resultado de coberturas contables;17.425;0;0;3;17.428
4400000;OTROS INGRESOS OPERACIONALES;14.832;0;0;10.943;25.775
4400100;Ingresos por bienes recibidos en pago;617;0;0;1.295;1.912
4400200;Liberación de provisiones por contingencias;0;0;0;756;756
4400290;Otras provisiones por contingencias;0;0;0;0;0
4400300;Otros ingresos;14.215;0;0;8.892;23.107
4500000;PROVISIONES POR RIESGO DE CREDITO;-91.207;0;0;-83.149;-174.356
4500100;Provisiones para créditos y cuentas por cobrar;-108.372;0;0;-84.859;-193.231
4500101;Provisiones colocaciones comerciales;-33.913;0;0;-33.166;-67.079
4500111;Provisiones colocaciones para vivienda;-741;0;0;-45;-786
4500112;Provisiones colocaciones de consumo;-73.713;0;0;-51.482;-125.195
4500190;Provisiones para créditos otorgados a bancos;-5;0;0;-166;-171
4500200;Provisiones para créditos contingentes;-7.066;0;0;-5.359;-12.425
4500700;Provisiones adicionales;0;0;0;0;0
4500701;Provisiones adicionales colocaciones comerciales;0;0;0;0;0
4500702;Provisiones adicionales colocaciones para vivienda;0;0;0;0;0
4500703;Provisiones adicionales colocaciones de consumo;0;0;0;0;0
4500800;Ajuste a provisión mínima cartera normal;0;0;0;0;0
4500801;Ajuste a provisión mínima adeudado por bancos;0;0;0;0;0
4500802;Ajuste a provisión mínima colocaciones comerciales;0;0;0;0;0
4500803;Ajuste a provisión mínima créditos contingentes;0;0;0;0;0
4500900;Recuperación de créditos castigados;24.231;0;0;7.069;31.300
4500901;Recuperación de créditos comerciales castigados;9.431;0;0;1.784;11.215
4500911;Recuperación de créditos para vivienda castigados;1.653;0;0;455;2.108
4500921;Recuperación de créditos de consumo castigados;13.147;0;0;4.830;17.977
4500931;Recuperación de otros créditos castigados;0;0;0;0;0
4600000;REMUNERACIONES Y GASTOS DEL PERSONAL;-146.960;0;0;-70.320;-217.280
4610000;GASTOS DE ADMINISTRACIÓN;-137.429;0;0;-74.848;-212.277
4610100;Gastos generales de administración;-108.895;0;0;-44.236;-153.131
4610200;Servicios subcontratados;-10.164;0;0;-7.537;-17.701
4610300;Gastos del Directorio;-1.025;0;0;-100;-1.125
4610400;Publicidad y propaganda;-7.982;0;0;-1.565;-9.547
4610500;Impuestos, contribuciones y aportes;-9.363;0;0;-21.410;-30.773
4620000;DEPRECIACIONES Y AMORTIZACIONES;-39.503;0;0;-25.197;-64.700
4630000;DETERIOROS;0;0;0;0;0
4650000;OTROS GASTOS OPERACIONALES;-36.609;0;0;-18.311;-54.920
4650100;Provisiones y gastos por bienes recibidos en pago;-7.346;0;0;-8.983;-16.329
4650200;Provisiones por contingencias;-1.769;0;0;-446;-2.215
4650201;Provisiones por riesgo país;0;0;0;0;0
4650211;Provisiones especiales para créditos al exterior;0;0;0;0;0
4650290;Otras provisiones por contingencias;-1.769;0;0;-446;-2.215
4650900;Otros gastos;-27.494;0;0;-8.882;-36.376
4700000;RESULTADO POR INVERSIONES EN SOCIEDADES;297;0;0;1.244;1.541
4700100;Utilidades por inversiones en sociedades;297;0;0;1.244;1.541
4700101;Sucursales en el exterior;0;0;0;0;0
4700103;Sociedades con influencia significativa;0;0;0;0;0
4700110;Percibido por acciones y derechos en otras sociedades;297;0;0;1.244;1.541
4700200;Pérdidas por inversiones en sociedades;0;0;0;0;0
4700201;Sucursales en el exterior;0;0;0;0;0
4700203;Sociedades con influencia significativa;0;0;0;0;0
4700210;Ajustes por deterioro de inversiones en sociedades;0;0;0;0;0
4800000;IMPUESTO A LA RENTA;-36.624;0;0;10;-36.614
4800001;Provisión impuesto a la renta;-56.371;0;0;-11.048;-67.419
4850000;RESULTADO DE OPERACIONES DESCONTINUADAS;0;0;0;0;0
4900000;INTERES NO CONTROLADOR;2.526;0;0;37;2.563
5003000;INGRESO NETO POR INTERESES Y REAJUSTES;216.168;171.054;575;232.702;620.499
5004000;INGRESO NETO POR COMISIONES;105.457;1.539;0;29.461;136.457
5005000;TOTAL INGRESOS OPERACIONALES;421.604;166.859;252;316.045;904.760
5006000;INGRESO OPERACIONAL NETO;330.397;166.859;252;232.896;730.404
5007000;RESULTADO OPERACIONAL;-30.104;166.859;252;44.220;181.227
5008000;RESULTADO ANTES DE IMPUESTO A LA RENTA;-29.807;166.859;252;45.464;182.768
5009000;RESULTADO DE OPERACIONES CONTINUAS;-66.431;166.859;252;45.474;146.154
5010000;UTILIDAD (PERDIDA) CONSOLIDADA DEL EJERCICIO;-66.431;166.859;252;45.474;146.154
5020000;RESULTADO DE LOS PROPIETARIOS;-68.957;166.859;252;45.437;143.591