Código Contable;Descripción;Moneda chilena no reajustable;Moneda chilena reajustable por factores de IPC;Moneda chilena reajustables por tipo de cambio;Moneda Extranjera;Total (suma de todas las monedas)

1000000;ACTIVOS;13.800.118;10.095.935;9.862;11.781.575;35.687.490
1100000;EFECTIVO Y DEPOSITOS EN BANCOS;1.232.614;0;0;1.856.458;3.089.072
1100100;Efectivo;184.330;0;0;69.870;254.200
1100200;Depósitos en el Banco Central de Chile;1.021.224;0;0;46.197;1.067.421
1100300;Depósitos en bancos del país;27.017;0;0;0;27.017
1100400;Depósitos en el exterior;43;0;0;1.740.391;1.740.434
1130000;OPERACIONES CON LIQUIDACION EN CURSO;110.503;0;0;62.689;173.192
1130100;Documentos a cargo de otros bancos (canje);34.329;0;0;2.701;37.030
1130200;Transferencias de fondos en curso;76.174;0;0;59.988;136.162
1150000;INSTRUMENTOS PARA NEGOCIACIÓN;142.975;355;0;437.039;580.369
1150100;Del Estado y Banco Central de Chile;107.687;355;0;0;108.042
1150200;Otros instrumentos emitidos en el país;271;0;0;0;271
1150300;Instrumentos emitidos en el exterior;0;0;0;437.039;437.039
1150400;Inversiones en Fondos Mutuos;35.017;0;0;0;35.017
1160000;CONTRATOS DE RETROCOMPRA Y PRÉSTAMOS DE VALORES;84.173;0;0;21.407;105.580
1160100;Operaciones con bancos del país;0;0;0;0;0
1160200;Operaciones con otras entidades;84.173;0;0;21.407;105.580
1250000;CONTRATOS DE DERIVADOS FINANCIEROS;2.529.980;387.035;0;1.065.788;3.982.803
1250100;Contratos de negociación;2.244.894;387.035;0;1.044.402;3.676.331
1250200;Contratos para cobertura contable;285.086;0;0;21.386;306.472
1270000;ADEUDADO POR BANCOS;0;0;0;7.115;7.115
1270100;Banco del país;0;0;0;0;0
1270112;Préstamos interbancarios de liquidez;0;0;0;0;0
1270113;Préstamos interbancarios comerciales;0;0;0;0;0
1270116;Créditos comercio exterior exportaciones chilenas;0;0;0;0;0
1270117;Créditos comercio exterior importaciones chilenas;0;0;0;0;0
1270118;Créditos comercio exterior entre terceros países;0;0;0;0;0
1270190;Provisiones para créditos con bancos del país;0;0;0;0;0
1270200;Bancos del exterior;0;0;0;7.115;7.115
1270202;Préstamos interbancarios de liquidez;0;0;0;0;0
1270203;Préstamos interbancarios comerciales;0;0;0;0;0
1270206;Créditos comercio exterior exportaciones chilenas;0;0;0;0;0
1270207;Créditos comercio exterior importaciones chilenas;0;0;0;0;0
1270208;Créditos comercio exterior entre terceros países;0;0;0;0;0
1270290;Provisiones para créditos con bancos del exterior;0;0;0;-16;-16
1270300;Banco Central de Chile;0;0;0;0;0
1300000;CRÉDITOS Y CUENTAS POR COBRAR A CLIENTES;5.850.863;9.000.355;9.592;6.870.948;21.731.758
1302000;COLOCACIONES COMERCIALES;4.770.008;4.359.790;9.592;5.734.993;14.874.383
1302100;Préstamos comerciales;4.259.358;3.436.094;0;4.484.801;12.180.253
1302101;Préstamos en el país;4.253.337;2.683.812;0;1.396.347;8.333.496
1302102;Préstamos en el exterior;6.021;0;0;3.088.454;3.094.475
1302170;Préstamos con letras de crédito para fines generales;0;4.913;0;0;4.913
1302180;Préstamos con mutuos hipotecarios endosables;0;747.369;0;0;747.369
1302200;Créditos de comercio exterior;101.344;76;0;748.079;849.499
1302201;Acreditivos negociados a plazo de exportaciones chilenas;0;0;0;0;0
1302202;Otros créditos para exportaciones chilenas;73.896;0;0;349.759;423.655
1302241;Acreditivos negociados a plazo de importaciones chilenas;27.358;0;0;353.839;381.197
1302242;Otros créditos para importaciones chilenas;90;76;0;8.659;8.825
1302281;Acreditivos negociados a plazo de operaciones entre terceros países;0;0;0;0;0
1302282;Otros créditos para operaciones entre terceros países;0;0;0;35.822;35.822
1302300;Deudores en cuentas corrientes;66.781;0;0;3.345;70.126
1302500;Operaciones de factoraje;122.723;286;0;32.531;155.540
1302600;Préstamos estudiantiles;0;649.505;0;0;649.505
1302601;Créditos para estudios superiores Ley N° 20.027;0;647.443;0;0;647.443
1302602;Créditos con garantía CORFO;0;1.665;0;0;1.665
1302604;Otros créditos para estudios superiores;0;397;0;0;397
1302800;Operaciones de leasing comercial;207.439;273.829;9.592;450.437;941.297
1302900;Otros créditos y cuentas por cobrar;12.363;0;0;15.800;28.163
1304000;COLOCACIONES PARA VIVIENDA;0;4.636.150;0;631.774;5.267.924
1304100;Préstamos con letras de crédito;0;23.345;0;0;23.345
1304101;Con letras de crédito para vivienda;0;21.648;0;0;21.648
1304102;Con letras de crédito para fines generales;0;1.697;0;0;1.697
1304200;Préstamos con mutuos hipotecarios endosable;0;90.456;0;0;90.456
1304400;Prestamos con mutuos financiados con bonos hipotecarios;0;0;0;0;0
1304500;Otros créditos con mutuos para vivienda;0;4.447.834;0;324.200;4.772.034
1304600;Créditos provenientes de la ANAP;0;0;0;0;0
1304800;Operaciones de leasing para vivienda;0;0;0;307.574;307.574
1304900;Otros créditos y cuentas por cobrar;0;74.515;0;0;74.515
1305000;COLOCACIONES DE CONSUMO;1.691.596;4.415;0;797.242;2.493.253
1305100;Créditos de consumo en cuotas;1.230.205;4.415;0;632.219;1.866.839
1305300;Deudores en cuentas corrientes;122.669;0;0;1.340;124.009
1305400;Deudores por tarjetas de crédito;338.319;0;0;129.305;467.624
1305800;Operaciones de leasing de consumo;403;0;0;1.064;1.467
1305900;Otros créditos y cuentas por cobrar;0;0;0;33.314;33.314
1309000;PROVISIONES CONSTITUIDAS;-610.741;0;0;-293.061;-903.802
1309100;Provisiones colocaciones comerciales;-491.304;0;0;-202.605;-693.909
1309200;Provisiones colocaciones para vivienda;-16.706;0;0;-25.381;-42.087
1309300;Provisiones colocaciones de consumo;-102.731;0;0;-65.075;-167.806
1350000;INSTRUMENTOS DE INVERSIÓN DISPONIBLES PARA LA VENTA;2.553.429;696.307;0;714.984;3.964.720
1350100;Del Estado y Banco Central de Chile;2.548.813;405.793;0;101.573;3.056.179
1350200;Otros instrumentos emitidos en el país;4.616;290.514;0;1.535;296.665
1350300;Instrumentos emitidos en el exterior;0;0;0;611.876;611.876
1360000;INSTRUMENTOS DE INVERSIÓN HASTA EL VENCIMIENTO;0;0;0;111.643;111.643
1360100;Del Estado y Banco Central de Chile;0;0;0;0;0
1360200;Otros instrumentos emitidos en el país;0;0;0;0;0
1360300;Instrumentos emitidos en el exterior;0;0;0;111.643;111.643
1400000;INVERSIONES EN SOCIEDADES;8.710;0;0;3.273;11.983
1400100;Inversiones a valor patrimonial;7.149;0;0;0;7.149
1400101;Sucursales en el exterior;0;0;0;0;0
1400103;Sociedades con influencia significativa;7.149;0;0;0;7.149
1400200;Acciones o derechos en otras sociedades;1.561;0;0;3.273;4.834
1500000;INTANGIBLES;682.535;0;0;36.148;718.683
1500100;Menor valor de inversiones (Goodwill);492.512;0;0;0;492.512
1500200;Otros activos intangibles;190.023;0;0;36.148;226.171
1600000;ACTIVO FIJO;31.833;0;0;24.187;56.020
1600100;Edificios y terrenos;4.690;0;0;10.875;15.565
1600200;Otros activos fijos;27.143;0;0;13.312;40.455
1650000;ACTIVO POR DERECHO A USAR BIENES EN ARRENDAMIENTO;135.625;0;0;34.978;170.603
1650100;Activo fijo;135.625;0;0;34.978;170.603
1650200;Otros activos intangibles;0;0;0;0;0
1700000;IMPUESTOS CORRIENTES;43.533;0;0;21.166;64.699
1750000;IMPUESTOS DIFERIDOS;245.271;0;0;68.841;314.112
1800000;OTROS ACTIVOS;148.074;11.883;270;444.911;605.138
1800100;Activos para leasing;1.149;0;0;9.658;10.807
1800200;Bienes recibidos en pago o adjudicados;6.776;0;0;2.233;9.009
1800900;Otros activos;140.149;11.883;270;433.020;585.322
2000000;PASIVOS;17.243.218;5.806.930;10.210;10.238.806;33.299.164
2100000;DEPOSITOS Y OTRAS OBLIGACIONES A LA VISTA;3.186.296;13.448;0;2.997.662;6.197.406
2100100;Cuentas corrientes;2.677.256;0;0;1.361.211;4.038.467
2100109;Cuentas corrientes de otras personas jurídicas;1.691.263;0;0;1.256.136;2.947.399
2100110;Cuentas corrientes de personas naturales;985.960;0;0;105.075;1.091.035
2100200;Otros depósitos y cuentas a la vista;336.230;0;0;1.516.125;1.852.355
2100300;Otras obligaciones a la vista;172.810;13.448;0;120.326;306.584
2130000;OPERACIONES CON LIQUIDACION EN CURSO;82.287;0;0;71.945;154.232
2160000;CONTRATOS DE RETROCOMPRA Y PRÉSTAMOS DE VALORES;399.593;0;0;239.258;638.851
2160100;Operaciones con bancos del país;6;0;0;0;6
2160200;Operaciones con otras entidades;399.587;0;0;239.258;638.845
2200000;DEPOSITOS Y OTRAS CAPTACIONES A PLAZO;8.042.117;402.118;1;2.988.828;11.433.064
2200100;Depósitos a plazo;8.041.890;402.114;1;2.969.365;11.413.370
2200200;Cuentas de ahorro a plazo;0;4;0;19.463;19.467
2200900;Otros saldos acreedores a plazo;227;0;0;0;227
2250000;CONTRATOS DE DERIVADOS FINANCIEROS;2.031.193;476.910;0;1.165.488;3.673.591
2250100;Contratos de negociación;2.009.365;421.072;0;1.080.704;3.511.141
2250200;Contratos para cobertura contable;21.828;55.838;0;84.784;162.450
2300000;OBLIGACIONES CON BANCOS;2.257.226;0;0;1.541.752;3.798.978
2301000;BANCOS DEL PAÍS;0;0;0;0;0
2301001;Préstamos interbancarios;0;0;0;0;0
2302000;BANCOS DEL EXTERIOR;0;0;0;1.541.752;1.541.752
2302100;Financiamientos de comercio exterior;0;0;0;8.463;8.463
2302200;Préstamos y otras obligaciones;0;0;0;1.533.289;1.533.289
2303000;BANCO CENTRAL DE CHILE;2.257.226;0;0;0;2.257.226
2303100;Préstamos y otras obligaciones;2.257.226;0;0;0;2.257.226
2303900;Líneas de crédito reprogramación de deudas;0;0;0;0;0
2400000;INSTRUMENTOS DE DEUDA EMITIDOS;835.961;4.636.431;0;732.464;6.204.856
2401000;LETRAS DE CREDITO;0;30.846;0;0;30.846
2402000;BONOS;835.961;4.605.585;0;732.464;6.174.010
2402100;Bonos corrientes;835.961;3.699.027;0;557.991;5.092.979
2402200;Bonos subordinados;0;906.558;0;174.473;1.081.031
2402300;Bonos hipotecarios;0;0;0;0;0
2500000;OTRAS OBLIGACIONES FINANCIERAS;13.123;0;0;0;13.123
2500100;Obligaciones con el sector público;0;0;0;0;0
2500200;Otras obligaciones en el país;13.123;0;0;0;13.123
2500300;Obligaciones con el exterior;0;0;0;0;0
2550000;OBLIGACIONES POR CONTRATOS DE ARRENDAMIENTO;561;118.189;156;32.979;151.885
2600000;IMPUESTOS CORRIENTES;596;0;0;1.170;1.766
2650000;IMPUESTOS DIFERIDOS;0;0;0;237;237
2700000;PROVISIONES;174.417;0;0;107.866;282.283
2700100;Provisiones para beneficios y remuneraciones del personal;32.413;0;0;58.326;90.739
2700200;Provisión para dividendos mínimos;0;0;0;0;0
2700300;Provisiones por riesgo de créditos contingentes;32.724;0;0;11.325;44.049
2700400;Provisiones por contingencias;109.280;0;0;38.215;147.495
2700401;Provisiones por riesgo país;1.462;0;0;3.610;5.072
2700402;Provisiones especiales para créditos al exterior;0;0;0;0;0
2700411;Provisiones adicionales colocaciones comerciales;38.100;0;0;15.273;53.373
2700412;Provisiones adicionales colocaciones para vivienda;15.500;0;0;0;15.500
2700413;Provisiones adicionales colocaciones de consumo;51.000;0;0;17.975;68.975
2700421;Ajuste a provisión mínima adeudado por bancos;0;0;0;0;0
2700422;Ajuste a provisión mínima colocaciones comerciales;0;0;0;0;0
2700423;Ajuste a provisión mínima créditos contingentes;0;0;0;0;0
2700490;Otras provisiones por contingencias;3.218;0;0;1.357;4.575
2800000;OTROS PASIVOS;219.848;159.834;10.053;359.157;748.892
3000000;PATRIMONIO;2.067.516;242.246;552;78.012;2.388.326
3101000;CAPITAL;1.862.826;0;0;0;1.862.826
3102000;RESERVAS;1.195.849;0;0;0;1.195.849
3103000;CUENTAS DE VALORACIÓN;25.873;0;0;0;25.873
3104000;UTILIDADES RETENIDAS;-1.088.907;242.246;552;76.972;-769.137
3104100;Utilidades retenidas de ejercicios anteriores;156.342;0;0;0;156.342
3104200;Utilidad (pérdida) del ejercicio;-1.245.249;242.246;552;76.972;-925.479
3104300;Provisión para dividendos mínimos;0;0;0;0;0
3200000;INTERES NO CONTROLADOR;71.875;0;0;1.040;72.915
5001000;PATRIMONIO DE LOS PROPIETARIOS;1.995.641;242.246;552;76.972;2.315.411
5002000;TOTAL PASIVO Y PATRIMONIO;19.310.734;6.049.176;10.762;10.316.818;35.687.490
5100000;TOTAL COLOCACIONES;6.461.604;9.000.355;9.592;7.164.009;22.635.560