
Código Contable;Descripción;Moneda chilena no reajustable;Moneda chilena reajustable por factores de IPC;Moneda chilena reajustables por tipo de cambio;Moneda Extranjera;Total (suma de todas las monedas)
 
4100000;INGRESOS POR INTERESES Y REAJUSTES;516.813;187.758;99;514.427;1.219.097
4100100;Contratos de retrocompra;1.983;0;0;2.996;4.979
4100101;Intereses;1.964;0;0;2.996;4.960
4100151;Reajustes;19;0;0;0;19
4100200;Créditos otorgados a bancos;3.085;0;0;1.512;4.597
4100201;Intereses;3.085;0;0;1.512;4.597
4100251;Reajustes;0;0;0;0;0
4100300;Colocaciones comerciales;290.677;95.850;-213;316.116;702.430
4100301;Intereses de préstamos comerciales;229.905;37.820;0;227.309;495.034
4100309;Intereses de créditos de comercio exterior;5.176;0;0;33.906;39.082
4100310;Intereses de créditos en cuentas corrientes;19.170;0;0;3.154;22.324
4100320;Intereses de operaciones de factoraje;3.390;2;0;2.296;5.688
4100325;Intereses de préstamos estudiantiles;15.350;6.720;0;0;22.070
4100330;Intereses por leasing comercial;16.581;4.039;485;45.074;66.179
4100340;Intereses de otros créditos y cuentas por cobrar;14;0;0;4.299;4.313
4100351;Reajustes de préstamos comerciales;0;35.632;0;0;35.632
4100359;Reajustes de créditos de comercio exterior;0;0;0;0;0
4100360;Reajustes de créditos en cuentas corrientes;0;0;0;0;0
4100370;Reajustes de operaciones de factoraje;0;67;0;0;67
4100375;Reajustes de préstamos estudiantiles;0;7.675;0;0;7.675
4100380;Reajustes por leasing comercial;0;3.811;-698;0;3.113
4100390;Reajustes de otros créditos y cuentas por cobrar;0;84;0;0;84
4100399;Comisiones por prepago de créditos comerciales;1.091;0;0;78;1.169
4100400;Colocaciones para vivienda;51.013;87.728;0;39.658;178.399
4100401;Intereses de préstamos con letras de crédito;1.476;320;0;0;1.796
4100402;Comisiones de préstamos con letras de crédito;717;0;0;0;717
4100403;Intereses de prestamos con mutuos financiados con bonos hipotecarios;0;0;0;0;0
4100405;Intereses de préstamos con MHE;4.954;211;0;0;5.165
4100407;Intereses de otros mutuos para vivienda;42.870;47.935;0;17.834;108.639
4100408;Intereses de créditos ANAP;0;0;0;0;0
4100420;Intereses por leasing para vivienda;1;0;0;21.824;21.825
4100430;Intereses de otros créditos para vivienda;989;0;0;0;989
4100451;Reajustes de préstamos con letras de crédito;0;617;0;0;617
4100452;Reajustes de prestamos con mutuos financiados con bonos hipotecarios;0;0;0;0;0
4100455;Reajustes de préstamos con MHE;0;1.760;0;0;1.760
4100457;Reajustes de otros mutuos para vivienda;0;36.567;0;0;36.567
4100458;Reajustes de créditos ANAP;0;0;0;0;0
4100480;Reajustes por leasing para vivienda;0;0;0;0;0
4100490;Reajustes de otros créditos para vivienda;0;318;0;0;318
4100499;Comisiones por prepago de créditos para vivienda;6;0;0;0;6
4100500;Colocaciones de consumo;147.699;186;1;122.112;269.998
4100501;Intereses de créditos de consumo en cuotas;83.973;142;0;97.817;181.932
4100510;Intereses de créditos en cuentas corrientes;35.411;0;0;896;36.307
4100520;Intereses de créditos por tarjetas de crédito;26.969;0;0;21.467;48.436
4100530;Intereses por leasing de consumo;50;3;0;1.297;1.350
4100540;Intereses de otros créditos de consumo;2;0;0;635;637
4100590;Reajustes colocaciones de consumo;0;41;1;0;42
4100599;Comisiones por prepago de créditos de consumo;1.294;0;0;0;1.294
4100600;Instrumentos de inversión;22.476;3.958;0;26.580;53.014
4100601;Intereses de inversiones disponibles para la venta;22.476;0;0;23.007;45.483
4100621;Intereses de inversiones hasta el vencimiento;0;0;0;3.573;3.573
4100651;Reajustes de inversiones disponibles para la venta;0;3.958;0;0;3.958
4100671;Reajustes de inversiones hasta el vencimiento;0;0;0;0;0
4100800;Otros ingresos por intereses o reajustes;1.428;36;311;5.452;7.227
4100801;Intereses por saldos en cuentas corrientes;0;0;0;0;0
4100804;Intereses operaciones overnight;0;0;311;695;1.006
4100810;Otros intereses ganados;1.422;0;0;4.757;6.179
4100850;Otros reajustes ganados;6;36;0;0;42
4100900;Resultado de coberturas contables;-1.548;0;0;1;-1.547
4150000;GASTOS POR INTERESES Y REAJUSTES;-232.037;-120.070;0;-315.026;-667.133
4150100;Depósitos a la vista;-3.781;-102;0;-54.507;-58.390
4150101;Intereses por cuentas corrientes;-3.781;0;0;-935;-4.716
4150102;Intereses por otros depósitos y cuentas a la vista;0;0;0;-53.572;-53.572
4150103;Intereses por otras obligaciones a la vista;0;0;0;0;0
4150151;Reajustes por obligaciones a la vista;0;-102;0;0;-102
4150200;Contratos de retrocompra;-4.046;-1;0;-19.163;-23.210
4150201;Intereses;-4.046;-1;0;-19.163;-23.210
4150251;Reajustes;0;0;0;0;0
4150300;Depósitos y captaciones a plazo;-155.770;-23.057;0;-154.160;-332.987
4150301;Intereses por depósitos a plazo;-155.760;-13.893;0;-152.526;-322.179
4150302;Intereses por cuentas de ahorro a plazo;-10;0;0;-1.634;-1.644
4150309;Intereses de otros saldos acreedores a plazo;0;0;0;0;0
4150351;Reajustes por depósitos a plazo;0;-9.071;0;0;-9.071
4150352;Reajustes por cuentas de ahorro a plazo;0;-93;0;0;-93
4150359;Reajustes de otros saldos acreedores a plazo;0;0;0;0;0
4150400;Obligaciones con bancos;-3.038;-3.970;0;-34.830;-41.838
4150401;Intereses;-3.038;-1.596;0;-34.830;-39.464
4150451;Reajustes;0;-2.374;0;0;-2.374
4150500;Instrumentos de deuda emitidos;-65.490;-91.497;0;-51.759;-208.746
4150501;Intereses por letras de crédito;-1.140;-466;0;0;-1.606
4150511;Intereses por bonos corrientes;-42.457;-36.849;0;-51.575;-130.881
4150521;Intereses por bonos subordinados;-21.893;-2.971;0;-184;-25.048
4150522;Intereses por bonos hipotecarios;0;0;0;0;0
4150551;Reajustes por letras de crédito;0;-861;0;0;-861
4150561;Reajustes por bonos corrientes;0;-42.447;0;0;-42.447
4150571;Reajustes por bonos subordinados;0;-7.903;0;0;-7.903
4150572;Reajustes por bonos hipotecarios;0;0;0;0;0
4150600;Otras obligaciones financieras;0;0;0;-84;-84
4150601;Intereses;0;0;0;-84;-84
4150651;Reajustes;0;0;0;0;0
4150800;Otros gastos por intereses o reajustes;-1;-1.443;0;-523;-1.967
4150801;Intereses;0;0;0;-523;-523
4150851;Reajustes;-1;-1.443;0;0;-1.444
4150900;Resultado de coberturas contables;89;0;0;0;89
4200000;INGRESOS POR COMISIONES;105.357;1.175;0;54.041;160.573
4200100;Comisiones por líneas de crédito y sobregiros;1.625;0;0;709;2.334
4200200;Comisiones por avales y cartas de crédito;5.023;1.175;0;4.590;10.788
4200300;Comisiones por servicios de tarjetas;34.433;0;0;12.682;47.115
4200303;Tarjetas de cajeros automáticos;8.857;0;0;1.537;10.394
4200304;Tarjetas de crédito-comisiones a titulares;6.464;0;0;2.515;8.979
4200305;Tarjetas de crédito-comisiones de establecimientos;9.837;0;0;5.945;15.782
4200306;Tarjetas de débito-comisiones de titulares;6.347;0;0;502;6.849
4200307;Tarjetas de débito-comisiones de establecimientos;2.928;0;0;541;3.469
4200309;Otras tarjetas;0;0;0;1.642;1.642
4200400;Comisiones por administración de cuentas;7.746;0;0;1.777;9.523
4200500;Comisiones por cobranzas, recaudaciones y pagos;8.493;0;0;10.352;18.845
4200600;Comisiones por intermediación y manejo de valores;3.721;0;0;4.841;8.562
4200700;Comisiones por inversiones en fondos mutuos u otros;12.405;0;0;7.261;19.666
4200800;Remuneraciones por comercialización de seguros;15.635;0;0;3.454;19.089
4200900;Otras comisiones ganadas;16.276;0;0;8.375;24.651
4250000;GASTOS POR COMISIONES;-9.285;0;0;-19.623;-28.908
4250100;Remuneraciones por operación de tarjetas;-7.870;0;0;-9.510;-17.380
4250101;Comisiones por operación de tarjetas de crédito;-3.274;0;0;-9.465;-12.739
4250102;Comisiones por operación de tarjetas de débito y cajeros;-4.596;0;0;-45;-4.641
4250190;Otras;0;0;0;0;0
4250200;Comisiones por operación con valores;-1.064;0;0;-2.583;-3.647
4250300;Otras comisiones;-351;0;0;-7.530;-7.881
4300000;UTILIDAD NETA DE OPERACIONES FINANCIERAS;19.372;-13.045;89;35.803;42.219
4300100;Instrumentos financieros para negociación;5.137;-85;0;32.621;37.673
4300101;Intereses y reajustes;1.947;-74;0;21.329;23.202
4300102;Ajuste a valor razonable;2.944;-11;0;10.526;13.459
4300103;Utilidad por venta;459;0;0;4.777;5.236
4300104;Pérdida por venta;-687;0;0;-4.011;-4.698
4300190;Resultado inversiones en Fondos Mutuos;474;0;0;0;474
4300200;Derivados de negociación;5.446;-12.960;0;-1.537;-9.051
4300300;Venta de instrumentos disponibles para la venta;7.559;0;0;2.907;10.466
4300400;Venta de cartera de créditos;102;0;0;1.572;1.674
4300500;Resultado neto de otras operaciones;1.128;0;89;240;1.457
4350000;UTILIDAD (PÉRDIDA) DE CAMBIO NETA;18.048;273;0;12.888;31.209
4350100;Resultado neto de cambio monedas extranjeras;69.697;0;0;12.854;82.551
4350200;Resultados neto por reajustes por tipo de cambio;0;273;0;0;273
4350900;Resultado de coberturas contables;-51.649;0;0;34;-51.615
4400000;OTROS INGRESOS OPERACIONALES;34.457;0;0;9.265;43.722
4400100;Ingresos por bienes recibidos en pago;1.759;0;0;5.325;7.084
4400200;Liberación de provisiones por contingencias;0;0;0;0;0
4400290;Otras provisiones por contingencias;0;0;0;0;0
4400300;Otros ingresos;32.698;0;0;3.940;36.638
4500000;PROVISIONES POR RIESGO DE CREDITO;-105.528;0;0;-108.143;-213.671
4500100;Provisiones para créditos y cuentas por cobrar;-109.994;0;0;-108.078;-218.072
4500101;Provisiones colocaciones comerciales;-39.512;0;0;-60.528;-100.040
4500111;Provisiones colocaciones para vivienda;-2.600;0;0;-4.321;-6.921
4500112;Provisiones colocaciones de consumo;-67.806;0;0;-43.201;-111.007
4500190;Provisiones para créditos otorgados a bancos;-76;0;0;-28;-104
4500200;Provisiones para créditos contingentes;-13.565;0;0;-4.399;-17.964
4500700;Provisiones adicionales;0;0;0;0;0
4500701;Provisiones adicionales colocaciones comerciales;0;0;0;0;0
4500702;Provisiones adicionales colocaciones para vivienda;0;0;0;0;0
4500703;Provisiones adicionales colocaciones de consumo;0;0;0;0;0
4500800;Ajuste a provisión mínima cartera normal;0;0;0;0;0
4500801;Ajuste a provisión mínima adeudado por bancos;0;0;0;0;0
4500802;Ajuste a provisión mínima colocaciones comerciales;0;0;0;0;0
4500803;Ajuste a provisión mínima créditos contingentes;0;0;0;0;0
4500900;Recuperación de créditos castigados;18.031;0;0;4.334;22.365
4500901;Recuperación de créditos comerciales castigados;7.397;0;0;1.427;8.824
4500911;Recuperación de créditos para vivienda castigados;1.160;0;0;247;1.407
4500921;Recuperación de créditos de consumo castigados;9.474;0;0;2.660;12.134
4500931;Recuperación de otros créditos castigados;0;0;0;0;0
4600000;REMUNERACIONES Y GASTOS DEL PERSONAL;-138.763;0;0;-69.166;-207.929
4610000;GASTOS DE ADMINISTRACIÓN;-145.492;0;-86;-82.085;-227.663
4610100;Gastos generales de administración;-115.055;0;0;-47.251;-162.306
4610200;Servicios subcontratados;-10.445;0;-86;-8.567;-19.098
4610300;Gastos del Directorio;-938;0;0;-91;-1.029
4610400;Publicidad y propaganda;-8.134;0;0;-1.456;-9.590
4610500;Impuestos, contribuciones y aportes;-10.920;0;0;-24.720;-35.640
4620000;DEPRECIACIONES Y AMORTIZACIONES;-38.150;0;0;-23.466;-61.616
4630000;DETERIOROS;-27;0;0;0;-27
4650000;OTROS GASTOS OPERACIONALES;-15.640;0;0;-24.797;-40.437
4650100;Provisiones y gastos por bienes recibidos en pago;-2.315;0;0;-12.207;-14.522
4650200;Provisiones por contingencias;-5;0;0;-1.055;-1.060
4650201;Provisiones por riesgo país;0;0;0;-910;-910
4650211;Provisiones especiales para créditos al exterior;0;0;0;0;0
4650290;Otras provisiones por contingencias;-5;0;0;-145;-150
4650900;Otros gastos;-13.320;0;0;-11.535;-24.855
4700000;RESULTADO POR INVERSIONES EN SOCIEDADES;292;0;0;882;1.174
4700100;Utilidades por inversiones en sociedades;292;0;0;882;1.174
4700101;Sucursales en el exterior;0;0;0;0;0
4700103;Sociedades con influencia significativa;0;0;0;0;0
4700110;Percibido por acciones y derechos en otras sociedades;292;0;0;882;1.174
4700200;Pérdidas por inversiones en sociedades;0;0;0;0;0
4700201;Sucursales en el exterior;0;0;0;0;0
4700203;Sociedades con influencia significativa;0;0;0;0;0
4700210;Ajustes por deterioro de inversiones en sociedades;0;0;0;0;0
4800000;IMPUESTO A LA RENTA;6.406;0;0;27.211;33.617
4800001;Provisión impuesto a la renta;-9.369;0;0;-9.802;-19.171
4850000;RESULTADO DE OPERACIONES DESCONTINUADAS;0;0;0;0;0
4900000;INTERES NO CONTROLADOR;-876;0;0;38;-838
5003000;INGRESO NETO POR INTERESES Y REAJUSTES;284.776;67.688;99;199.401;551.964
5004000;INGRESO NETO POR COMISIONES;96.072;1.175;0;34.418;131.665
5005000;TOTAL INGRESOS OPERACIONALES;452.725;56.091;188;291.775;800.779
5006000;INGRESO OPERACIONAL NETO;347.197;56.091;188;183.632;587.108
5007000;RESULTADO OPERACIONAL;9.125;56.091;102;-15.882;49.436
5008000;RESULTADO ANTES DE IMPUESTO A LA RENTA;9.417;56.091;102;-15.000;50.610
5009000;RESULTADO DE OPERACIONES CONTINUAS;15.823;56.091;102;12.211;84.227
5010000;UTILIDAD (PERDIDA) CONSOLIDADA DEL EJERCICIO;15.823;56.091;102;12.211;84.227
5020000;RESULTADO DE LOS PROPIETARIOS;16.699;56.091;102;12.173;85.065