
Código Contable;Descripción;Moneda chilena no reajustable;Moneda chilena reajustable por factores de IPC;Moneda chilena reajustables por tipo de cambio;Moneda Extranjera;Total (suma de todas las monedas)
 
4100000;INGRESOS POR INTERESES Y REAJUSTES;266.022;519.408;0;312.987;1.098.417
4100100;Contratos de retrocompra;1.062;0;0;364;1.426
4100101;Intereses;1.062;0;0;364;1.426
4100151;Reajustes;0;0;0;0;0
4100200;Créditos otorgados a bancos;54;0;0;292;346
4100201;Intereses;54;0;0;292;346
4100251;Reajustes;0;0;0;0;0
4100300;Colocaciones comerciales;161.098;227.504;0;174.776;563.378
4100301;Intereses de préstamos comerciales;134.848;54.488;0;134.465;323.801
4100309;Intereses de créditos de comercio exterior;1.895;0;0;14.356;16.251
4100310;Intereses de créditos en cuentas corrientes;7.795;3;0;509;8.307
4100320;Intereses de operaciones de factoraje;3.423;76;0;1.194;4.693
4100325;Intereses de préstamos estudiantiles;0;21.133;0;0;21.133
4100330;Intereses por leasing comercial;8.679;6.583;0;20.913;36.175
4100340;Intereses de otros créditos y cuentas por cobrar;59;1;0;3.089;3.149
4100351;Reajustes de préstamos comerciales;0;112.522;0;0;112.522
4100359;Reajustes de créditos de comercio exterior;0;0;0;0;0
4100360;Reajustes de créditos en cuentas corrientes;0;0;0;0;0
4100370;Reajustes de operaciones de factoraje;0;8;0;0;8
4100375;Reajustes de préstamos estudiantiles;0;22.878;0;0;22.878
4100380;Reajustes por leasing comercial;0;9.458;0;0;9.458
4100390;Reajustes de otros créditos y cuentas por cobrar;0;0;0;0;0
4100399;Comisiones por prepago de créditos comerciales;4.399;354;0;250;5.003
4100400;Colocaciones para vivienda;12;263.135;0;40.624;303.771
4100401;Intereses de préstamos con letras de crédito;0;723;0;0;723
4100402;Comisiones de préstamos con letras de crédito;0;245;0;0;245
4100403;Intereses de prestamos con mutuos financiados con bonos hipotecarios;0;0;0;0;0
4100405;Intereses de préstamos con MHE;0;2.778;0;0;2.778
4100407;Intereses de otros mutuos para vivienda;7;90.480;0;20.707;111.194
4100408;Intereses de créditos ANAP;0;0;0;0;0
4100420;Intereses por leasing para vivienda;0;0;0;19.917;19.917
4100430;Intereses de otros créditos para vivienda;0;280;0;0;280
4100451;Reajustes de préstamos con letras de crédito;0;709;0;0;709
4100452;Reajustes de prestamos con mutuos financiados con bonos hipotecarios;0;0;0;0;0
4100455;Reajustes de préstamos con MHE;0;2.760;0;0;2.760
4100457;Reajustes de otros mutuos para vivienda;0;162.338;0;0;162.338
4100458;Reajustes de créditos ANAP;0;0;0;0;0
4100480;Reajustes por leasing para vivienda;0;0;0;0;0
4100490;Reajustes de otros créditos para vivienda;0;1.956;0;0;1.956
4100499;Comisiones por prepago de créditos para vivienda;5;866;0;0;871
4100500;Colocaciones de consumo;147.650;281;0;75.666;223.597
4100501;Intereses de créditos de consumo en cuotas;100.883;156;0;59.615;160.654
4100510;Intereses de créditos en cuentas corrientes;18.332;0;0;237;18.569
4100520;Intereses de créditos por tarjetas de crédito;26.652;0;0;15.660;42.312
4100530;Intereses por leasing de consumo;15;0;0;67;82
4100540;Intereses de otros créditos de consumo;0;0;0;87;87
4100590;Reajustes colocaciones de consumo;0;125;0;0;125
4100599;Comisiones por prepago de créditos de consumo;1.768;0;0;0;1.768
4100600;Instrumentos de inversión;7.980;25.739;0;19.377;53.096
4100601;Intereses de inversiones disponibles para la venta;7.980;0;0;2.421;10.401
4100621;Intereses de inversiones hasta el vencimiento;0;0;0;16.956;16.956
4100651;Reajustes de inversiones disponibles para la venta;0;25.739;0;0;25.739
4100671;Reajustes de inversiones hasta el vencimiento;0;0;0;0;0
4100800;Otros ingresos por intereses o reajustes;2.664;2.749;0;2.196;7.609
4100801;Intereses por saldos en cuentas corrientes;0;0;0;0;0
4100804;Intereses operaciones overnight;2.603;0;0;1;2.604
4100810;Otros intereses ganados;42;0;0;2.195;2.237
4100850;Otros reajustes ganados;19;2.749;0;0;2.768
4100900;Resultado de coberturas contables;-54.498;0;0;-308;-54.806
4150000;GASTOS POR INTERESES Y REAJUSTES;-44.409;-277.778;0;-102.504;-424.691
4150100;Depósitos a la vista;-2.788;-635;0;-16.867;-20.290
4150101;Intereses por cuentas corrientes;-2.788;0;0;-851;-3.639
4150102;Intereses por otros depósitos y cuentas a la vista;0;0;0;-16.016;-16.016
4150103;Intereses por otras obligaciones a la vista;0;0;0;0;0
4150151;Reajustes por obligaciones a la vista;0;-635;0;0;-635
4150200;Contratos de retrocompra;-657;0;0;-2.864;-3.521
4150201;Intereses;-654;0;0;-2.864;-3.518
4150251;Reajustes;-3;0;0;0;-3
4150300;Depósitos y captaciones a plazo;-35.892;-24.664;0;-40.360;-100.916
4150301;Intereses por depósitos a plazo;-35.892;-14.422;0;-40.233;-90.547
4150302;Intereses por cuentas de ahorro a plazo;0;0;0;-127;-127
4150309;Intereses de otros saldos acreedores a plazo;0;0;0;0;0
4150351;Reajustes por depósitos a plazo;0;-10.242;0;0;-10.242
4150352;Reajustes por cuentas de ahorro a plazo;0;0;0;0;0
4150359;Reajustes de otros saldos acreedores a plazo;0;0;0;0;0
4150400;Obligaciones con bancos;-10.410;0;0;-10.190;-20.600
4150401;Intereses;-10.410;0;0;-10.190;-20.600
4150451;Reajustes;0;0;0;0;0
4150500;Instrumentos de deuda emitidos;-39.789;-244.949;0;-31.005;-315.743
4150501;Intereses por letras de crédito;0;-361;0;0;-361
4150511;Intereses por bonos corrientes;-39.789;-45.879;0;-31.005;-116.673
4150521;Intereses por bonos subordinados;0;-27.872;0;0;-27.872
4150522;Intereses por bonos hipotecarios;0;0;0;0;0
4150551;Reajustes por letras de crédito;0;-886;0;0;-886
4150561;Reajustes por bonos corrientes;0;-140.673;0;0;-140.673
4150571;Reajustes por bonos subordinados;0;-29.278;0;0;-29.278
4150572;Reajustes por bonos hipotecarios;0;0;0;0;0
4150600;Otras obligaciones financieras;0;0;0;-38;-38
4150601;Intereses;0;0;0;-38;-38
4150651;Reajustes;0;0;0;0;0
4150700;Obligaciones por contratos de arrendamiento;-1.742;0;0;-1.143;-2.885
4150701;Intereses;-1.742;0;0;-1.143;-2.885
4150751;Reajustes;0;0;0;0;0
4150800;Otros gastos por intereses o reajustes;-18;-7.530;0;-37;-7.585
4150801;Intereses;-11;0;0;-37;-48
4150851;Reajustes;-7;-7.530;0;0;-7.537
4150900;Resultado de coberturas contables;46.887;0;0;0;46.887
4200000;INGRESOS POR COMISIONES;108.072;3.547;0;52.146;163.765
4200100;Comisiones por líneas de crédito y sobregiros;1.309;0;0;615;1.924
4200200;Comisiones por avales y cartas de crédito;5.803;3.547;0;4.399;13.749
4200300;Comisiones por servicios de tarjetas;33.567;0;0;15.557;49.124
4200303;Tarjetas de cajeros automáticos;5.707;0;0;773;6.480
4200304;Tarjetas de crédito-comisiones a titulares;13.173;0;0;1.735;14.908
4200305;Tarjetas de crédito-comisiones de establecimientos;11.889;0;0;11.285;23.174
4200306;Tarjetas de débito-comisiones de titulares;2.720;0;0;33;2.753
4200307;Tarjetas de débito-comisiones de establecimientos;78;0;0;0;78
4200309;Otras tarjetas;0;0;0;1.731;1.731
4200400;Comisiones por administración de cuentas;7.280;0;0;1.925;9.205
4200500;Comisiones por cobranzas, recaudaciones y pagos;8.772;0;0;9.702;18.474
4200600;Comisiones por intermediación y manejo de valores;1.448;0;0;6.238;7.686
4200700;Comisiones por inversiones en fondos mutuos u otros;9.835;0;0;6.405;16.240
4200800;Remuneraciones por comercialización de seguros;23.207;0;0;2.868;26.075
4200900;Otras comisiones ganadas;16.851;0;0;4.437;21.288
4250000;GASTOS POR COMISIONES;-22.035;0;0;-26.219;-48.254
4250100;Remuneraciones por operación de tarjetas;-17.360;0;0;-20.950;-38.310
4250101;Comisiones por operación de tarjetas de crédito;-7.654;0;0;-17.268;-24.922
4250102;Comisiones por operación de tarjetas de débito y cajeros;-1.680;0;0;-268;-1.948
4250190;Otras;-8.026;0;0;-3.414;-11.440
4250200;Comisiones por operación con valores;-2.191;0;0;-899;-3.090
4250300;Otras comisiones;-2.484;0;0;-4.370;-6.854
4300000;UTILIDAD NETA DE OPERACIONES FINANCIERAS;30.316;3.291;0;15.840;49.447
4300100;Instrumentos financieros para negociación;-5.376;63;0;-9.405;-14.718
4300101;Intereses y reajustes;2.202;63;0;17.669;19.934
4300102;Ajuste a valor razonable;750;0;0;-27.494;-26.744
4300103;Utilidad por venta;554;0;0;3.299;3.853
4300104;Pérdida por venta;-9.171;0;0;-2.879;-12.050
4300190;Resultado inversiones en Fondos Mutuos;289;0;0;0;289
4300200;Derivados de negociación;11.972;233;0;52.084;64.289
4300300;Venta de instrumentos disponibles para la venta;-24.128;2.995;0;4.371;-16.762
4300400;Venta de cartera de créditos;36.487;0;0;-30.926;5.561
4300500;Resultado neto de otras operaciones;11.361;0;0;-284;11.077
4350000;UTILIDAD (PÉRDIDA) DE CAMBIO NETA;54.502;0;1.096;44.096;99.694
4350100;Resultado neto de cambio monedas extranjeras;107.814;0;0;-11.582;96.232
4350200;Resultados neto por reajustes por tipo de cambio;0;0;1.096;0;1.096
4350900;Resultado de coberturas contables;-53.312;0;0;55.678;2.366
4400000;OTROS INGRESOS OPERACIONALES;10.504;0;0;12.858;23.362
4400100;Ingresos por bienes recibidos en pago;1.768;0;0;3.512;5.280
4400200;Liberación de provisiones por contingencias;218;0;0;0;218
4400290;Otras provisiones por contingencias;218;0;0;0;218
4400300;Otros ingresos;8.518;0;0;9.346;17.864
4500000;PROVISIONES POR RIESGO DE CREDITO;-85.578;0;0;-54.129;-139.707
4500100;Provisiones para créditos y cuentas por cobrar;-126.723;0;0;-73.887;-200.610
4500101;Provisiones colocaciones comerciales;-46.039;0;0;-33.652;-79.691
4500111;Provisiones colocaciones para vivienda;-6.991;0;0;-3.922;-10.913
4500112;Provisiones colocaciones de consumo;-69.329;0;0;-36.205;-105.534
4500190;Provisiones para créditos otorgados a bancos;0;0;0;-108;-108
4500191;Provisiones por deducible de garantÌas FOGAPE Covid-19;-4.364;0;0;0;-4.364
4500200;Provisiones para créditos contingentes;-9.991;0;0;144;-9.847
4500700;Provisiones adicionales;18.389;0;0;5.642;24.031
4500701;Provisiones adicionales colocaciones comerciales;-8.000;0;0;3.972;-4.028
4500702;Provisiones adicionales colocaciones para vivienda;3.478;0;0;0;3.478
4500703;Provisiones adicionales colocaciones de consumo;22.911;0;0;1.670;24.581
4500800;Ajuste a provisión mínima cartera normal;0;0;0;0;0
4500801;Ajuste a provisión mínima adeudado por bancos;0;0;0;0;0
4500802;Ajuste a provisión mínima colocaciones comerciales;0;0;0;0;0
4500803;Ajuste a provisión mínima créditos contingentes;0;0;0;0;0
4500900;Recuperación de créditos castigados;32.747;0;0;13.972;46.719
4500901;Recuperación de créditos comerciales castigados;11.768;0;0;4.983;16.751
4500911;Recuperación de créditos para vivienda castigados;3.375;0;0;233;3.608
4500921;Recuperación de créditos de consumo castigados;17.604;0;0;8.756;26.360
4500931;Recuperación de otros créditos castigados;0;0;0;0;0
4600000;REMUNERACIONES Y GASTOS DEL PERSONAL;-146.745;0;0;-68.950;-215.695
4610000;GASTOS DE ADMINISTRACIÓN;-126.245;-432;0;-59.894;-186.571
4610100;Gastos generales de administración;-94.498;-432;0;-36.888;-131.818
4610200;Servicios subcontratados;-16.254;0;0;-5.115;-21.369
4610300;Gastos del Directorio;-904;0;0;-85;-989
4610400;Publicidad y propaganda;-6.590;0;0;-2.458;-9.048
4610500;Impuestos, contribuciones y aportes;-7.999;0;0;-15.348;-23.347
4620000;DEPRECIACIONES Y AMORTIZACIONES;-60.647;0;0;-14.030;-74.677
4630000;DETERIOROS;-34;0;0;-1;-35
4650000;OTROS GASTOS OPERACIONALES;-22.843;0;0;-8.516;-31.359
4650100;Provisiones y gastos por bienes recibidos en pago;-4.299;0;0;-2.368;-6.667
4650200;Provisiones por contingencias;-70;0;0;-35;-105
4650201;Provisiones por riesgo país;-70;0;0;-35;-105
4650211;Provisiones especiales para créditos al exterior;0;0;0;0;0
4650290;Otras provisiones por contingencias;0;0;0;0;0
4650900;Otros gastos;-18.474;0;0;-6.113;-24.587
4700000;RESULTADO POR INVERSIONES EN SOCIEDADES;-1.359;0;0;1.830;471
4700100;Utilidades por inversiones en sociedades;765;0;0;1.830;2.595
4700101;Sucursales en el exterior;0;0;0;0;0
4700103;Sociedades con influencia significativa;725;0;0;0;725
4700110;Percibido por acciones y derechos en otras sociedades;40;0;0;1.830;1.870
4700200;Pérdidas por inversiones en sociedades;-2.124;0;0;0;-2.124
4700201;Sucursales en el exterior;0;0;0;0;0
4700203;Sociedades con influencia significativa;-2.124;0;0;0;-2.124
4700210;Ajustes por deterioro de inversiones en sociedades;0;0;0;0;0
4800000;IMPUESTO A LA RENTA;-106.010;0;0;5.181;-100.829
4800001;Provisión impuesto a la renta;-16.880;0;0;-2.594;-19.474
4850000;RESULTADO DE OPERACIONES DESCONTINUADAS;0;0;0;0;0
4900000;INTERES NO CONTROLADOR;1.810;0;0;12;1.822
5003000;INGRESO NETO POR INTERESES Y REAJUSTES;221.613;241.630;0;210.483;673.726
5004000;INGRESO NETO POR COMISIONES;86.037;3.547;0;25.927;115.511
5005000;TOTAL INGRESOS OPERACIONALES;402.972;248.468;1.096;309.204;961.740
5006000;INGRESO OPERACIONAL NETO;317.394;248.468;1.096;255.075;822.033
5007000;RESULTADO OPERACIONAL;-39.120;248.036;1.096;103.684;313.696
5008000;RESULTADO ANTES DE IMPUESTO A LA RENTA;-40.479;248.036;1.096;105.514;314.167
5009000;RESULTADO DE OPERACIONES CONTINUAS;-146.489;248.036;1.096;110.695;213.338
5010000;UTILIDAD (PERDIDA) CONSOLIDADA DEL EJERCICIO;-146.489;248.036;1.096;110.695;213.338
5020000;RESULTADO DE LOS PROPIETARIOS;-148.299;248.036;1.096;110.683;211.516