
Código Contable;Descripción;Moneda chilena no reajustable;Moneda chilena reajustable por factores de IPC;Moneda chilena reajustables por tipo de cambio;Moneda Extranjera;Total (suma de todas las monedas)
 
4100000;INGRESOS POR INTERESES Y REAJUSTES;556.019;474.598;2.926;55.229;1.088.772
4100100;Contratos de retrocompra;493;0;0;0;493
4100101;Intereses;493;0;0;0;493
4100151;Reajustes;0;0;0;0;0
4100200;Créditos otorgados a bancos;725;0;0;0;725
4100201;Intereses;725;0;0;0;725
4100251;Reajustes;0;0;0;0;0
4100300;Colocaciones comerciales;229.297;170.825;2.926;48.946;451.994
4100301;Intereses de préstamos comerciales;180.395;73.719;0;18.150;272.264
4100309;Intereses de créditos de comercio exterior;8.118;90;0;28.708;36.916
4100310;Intereses de créditos en cuentas corrientes;15.067;0;0;0;15.067
4100320;Intereses de operaciones de factoraje;7.755;0;0;2.088;9.843
4100325;Intereses de préstamos estudiantiles;0;1.036;0;0;1.036
4100330;Intereses por leasing comercial;15.119;21.325;2.926;0;39.370
4100340;Intereses de otros créditos y cuentas por cobrar;190;1.025;0;0;1.215
4100351;Reajustes de préstamos comerciales;1;57.709;0;0;57.710
4100359;Reajustes de créditos de comercio exterior;0;62;0;0;62
4100360;Reajustes de créditos en cuentas corrientes;0;0;0;0;0
4100370;Reajustes de operaciones de factoraje;108;0;0;0;108
4100375;Reajustes de préstamos estudiantiles;0;557;0;0;557
4100380;Reajustes por leasing comercial;0;11.606;0;0;11.606
4100390;Reajustes de otros créditos y cuentas por cobrar;0;539;0;0;539
4100399;Comisiones por prepago de créditos comerciales;2.544;3.157;0;0;5.701
4100400;Colocaciones para vivienda;56;283.565;0;0;283.621
4100401;Intereses de préstamos con letras de crédito;0;624;0;0;624
4100402;Comisiones de préstamos con letras de crédito;0;235;0;0;235
4100403;Intereses de prestamos con mutuos financiados con bonos hipotecarios;0;1.883;0;0;1.883
4100405;Intereses de préstamos con MHE;0;637;0;0;637
4100407;Intereses de otros mutuos para vivienda;56;157.548;0;0;157.604
4100408;Intereses de créditos ANAP;0;0;0;0;0
4100420;Intereses por leasing para vivienda;0;0;0;0;0
4100430;Intereses de otros créditos para vivienda;0;0;0;0;0
4100451;Reajustes de préstamos con letras de crédito;0;292;0;0;292
4100452;Reajustes de prestamos con mutuos financiados con bonos hipotecarios;0;1.659;0;0;1.659
4100455;Reajustes de préstamos con MHE;0;144;0;0;144
4100457;Reajustes de otros mutuos para vivienda;0;120.321;0;0;120.321
4100458;Reajustes de créditos ANAP;0;0;0;0;0
4100480;Reajustes por leasing para vivienda;0;0;0;0;0
4100490;Reajustes de otros créditos para vivienda;0;0;0;0;0
4100499;Comisiones por prepago de créditos para vivienda;0;222;0;0;222
4100500;Colocaciones de consumo;293.103;735;0;0;293.838
4100501;Intereses de créditos de consumo en cuotas;159.152;395;0;0;159.547
4100510;Intereses de créditos en cuentas corrientes;38.561;0;0;0;38.561
4100520;Intereses de créditos por tarjetas de crédito;92.344;0;0;0;92.344
4100530;Intereses por leasing de consumo;168;35;0;0;203
4100540;Intereses de otros créditos de consumo;21;0;0;0;21
4100590;Reajustes colocaciones de consumo;0;207;0;0;207
4100599;Comisiones por prepago de créditos de consumo;2.857;98;0;0;2.955
4100600;Instrumentos de inversión;27.896;19.360;0;2.595;49.851
4100601;Intereses de inversiones disponibles para la venta;27.342;6.049;0;2.595;35.986
4100621;Intereses de inversiones hasta el vencimiento;0;0;0;0;0
4100651;Reajustes de inversiones disponibles para la venta;554;13.311;0;0;13.865
4100671;Reajustes de inversiones hasta el vencimiento;0;0;0;0;0
4100800;Otros ingresos por intereses o reajustes;5.512;113;0;3.688;9.313
4100801;Intereses por saldos en cuentas corrientes;0;0;0;0;0
4100804;Intereses operaciones overnight;0;0;0;0;0
4100810;Otros intereses ganados;2.640;0;0;3.688;6.328
4100850;Otros reajustes ganados;2.872;113;0;0;2.985
4100900;Resultado de coberturas contables;-1.063;0;0;0;-1.063
4150000;GASTOS POR INTERESES Y REAJUSTES;-172.945;-158.763;0;-57.019;-388.727
4150100;Depósitos a la vista;-6.238;-539;0;0;-6.777
4150101;Intereses por cuentas corrientes;-6.238;0;0;0;-6.238
4150102;Intereses por otros depósitos y cuentas a la vista;0;0;0;0;0
4150103;Intereses por otras obligaciones a la vista;0;0;0;0;0
4150151;Reajustes por obligaciones a la vista;0;-539;0;0;-539
4150200;Contratos de retrocompra;-1.483;0;0;-736;-2.219
4150201;Intereses;-1.483;0;0;-736;-2.219
4150251;Reajustes;0;0;0;0;0
4150300;Depósitos y captaciones a plazo;-129.820;-23.819;0;-15.415;-169.054
4150301;Intereses por depósitos a plazo;-129.818;-7.023;0;-15.415;-152.256
4150302;Intereses por cuentas de ahorro a plazo;-2;-58;0;0;-60
4150309;Intereses de otros saldos acreedores a plazo;0;0;0;0;0
4150351;Reajustes por depósitos a plazo;0;-15.337;0;0;-15.337
4150352;Reajustes por cuentas de ahorro a plazo;0;-1.401;0;0;-1.401
4150359;Reajustes de otros saldos acreedores a plazo;0;0;0;0;0
4150400;Obligaciones con bancos;-1.181;0;0;-14.153;-15.334
4150401;Intereses;-1.181;0;0;-14.153;-15.334
4150451;Reajustes;0;0;0;0;0
4150500;Instrumentos de deuda emitidos;-26.397;-129.970;0;-23.624;-179.991
4150501;Intereses por letras de crédito;0;-810;0;0;-810
4150511;Intereses por bonos corrientes;-26.397;-48.966;0;-23.624;-98.987
4150521;Intereses por bonos subordinados;0;-15.766;0;0;-15.766
4150522;Intereses por bonos hipotecarios;0;-1.456;0;0;-1.456
4150551;Reajustes por letras de crédito;0;-412;0;0;-412
4150561;Reajustes por bonos corrientes;0;-51.297;0;0;-51.297
4150571;Reajustes por bonos subordinados;0;-10.002;0;0;-10.002
4150572;Reajustes por bonos hipotecarios;0;-1.261;0;0;-1.261
4150600;Otras obligaciones financieras;-1.467;-28;0;0;-1.495
4150601;Intereses;-1.442;0;0;0;-1.442
4150651;Reajustes;-25;-28;0;0;-53
4150800;Otros gastos por intereses o reajustes;-279;-4.407;0;-3.091;-7.777
4150801;Intereses;-186;0;0;-3.091;-3.277
4150851;Reajustes;-93;-4.407;0;0;-4.500
4150900;Resultado de coberturas contables;-6.080;0;0;0;-6.080
4200000;INGRESOS POR COMISIONES;238.744;4.761;0;3.043;246.548
4200100;Comisiones por líneas de crédito y sobregiros;3.202;0;0;1;3.203
4200200;Comisiones por avales y cartas de crédito;8.552;4.761;0;3.019;16.332
4200300;Comisiones por servicios de tarjetas;111.742;0;0;0;111.742
4200303;Tarjetas de cajeros automáticos;0;0;0;0;0
4200304;Tarjetas de crédito-comisiones a titulares;46.288;0;0;0;46.288
4200305;Tarjetas de crédito-comisiones de establecimientos;35.734;0;0;0;35.734
4200306;Tarjetas de débito-comisiones de titulares;16.864;0;0;0;16.864
4200307;Tarjetas de débito-comisiones de establecimientos;12.838;0;0;0;12.838
4200309;Otras tarjetas;18;0;0;0;18
4200400;Comisiones por administración de cuentas;16.532;0;0;0;16.532
4200500;Comisiones por cobranzas, recaudaciones y pagos;23.316;0;0;0;23.316
4200600;Comisiones por intermediación y manejo de valores;5.203;0;0;0;5.203
4200700;Comisiones por inversiones en fondos mutuos u otros;0;0;0;0;0
4200800;Remuneraciones por comercialización de seguros;18.824;0;0;0;18.824
4200900;Otras comisiones ganadas;51.373;0;0;23;51.396
4250000;GASTOS POR COMISIONES;-90.714;0;0;-1.516;-92.230
4250100;Remuneraciones por operación de tarjetas;-81.817;0;0;0;-81.817
4250101;Comisiones por operación de tarjetas de crédito;-58.869;0;0;0;-58.869
4250102;Comisiones por operación de tarjetas de débito y cajeros;-21.114;0;0;0;-21.114
4250190;Otras;-1.834;0;0;0;-1.834
4250200;Comisiones por operación con valores;-485;0;0;0;-485
4250300;Otras comisiones;-8.412;0;0;-1.516;-9.928
4300000;UTILIDAD NETA DE OPERACIONES FINANCIERAS;-13.139;4.265;0;21;-8.853
4300100;Instrumentos financieros para negociación;2.460;3.699;0;12;6.171
4300101;Intereses y reajustes;1.096;3.701;0;10;4.807
4300102;Ajuste a valor razonable;2.694;0;0;-14;2.680
4300103;Utilidad por venta;1.109;0;0;29;1.138
4300104;Pérdida por venta;-2.454;-2;0;-13;-2.469
4300190;Resultado inversiones en Fondos Mutuos;15;0;0;0;15
4300200;Derivados de negociación;-21.729;0;0;0;-21.729
4300300;Venta de instrumentos disponibles para la venta;6.592;566;0;9;7.167
4300400;Venta de cartera de créditos;799;0;0;0;799
4300500;Resultado neto de otras operaciones;-1.261;0;0;0;-1.261
4350000;UTILIDAD (PÉRDIDA) DE CAMBIO NETA;45.530;0;5.104;0;50.634
4350100;Resultado neto de cambio monedas extranjeras;-83.651;0;0;0;-83.651
4350200;Resultados neto por reajustes por tipo de cambio;-21;0;5.104;0;5.083
4350900;Resultado de coberturas contables;129.202;0;0;0;129.202
4400000;OTROS INGRESOS OPERACIONALES;24.564;0;0;0;24.564
4400100;Ingresos por bienes recibidos en pago;12.216;0;0;0;12.216
4400200;Liberación de provisiones por contingencias;11.576;0;0;0;11.576
4400290;Otras provisiones por contingencias;11.576;0;0;0;11.576
4400300;Otros ingresos;772;0;0;0;772
4500000;PROVISIONES POR RIESGO DE CREDITO;-155.406;0;0;0;-155.406
4500100;Provisiones para créditos y cuentas por cobrar;-199.510;0;0;0;-199.510
4500101;Provisiones colocaciones comerciales;-70.543;0;0;0;-70.543
4500111;Provisiones colocaciones para vivienda;-11.837;0;0;0;-11.837
4500112;Provisiones colocaciones de consumo;-117.157;0;0;0;-117.157
4500190;Provisiones para créditos otorgados a bancos;27;0;0;0;27
4500200;Provisiones para créditos contingentes;-1.153;0;0;0;-1.153
4500700;Provisiones adicionales;0;0;0;0;0
4500701;Provisiones adicionales colocaciones comerciales;0;0;0;0;0
4500702;Provisiones adicionales colocaciones para vivienda;0;0;0;0;0
4500703;Provisiones adicionales colocaciones de consumo;0;0;0;0;0
4500800;Ajuste a provisión mínima cartera normal;0;0;0;0;0
4500801;Ajuste a provisión mínima adeudado por bancos;0;0;0;0;0
4500802;Ajuste a provisión mínima colocaciones comerciales;0;0;0;0;0
4500803;Ajuste a provisión mínima créditos contingentes;0;0;0;0;0
4500900;Recuperación de créditos castigados;45.257;0;0;0;45.257
4500901;Recuperación de créditos comerciales castigados;15.885;0;0;0;15.885
4500911;Recuperación de créditos para vivienda castigados;9.553;0;0;0;9.553
4500921;Recuperación de créditos de consumo castigados;19.819;0;0;0;19.819
4500931;Recuperación de otros créditos castigados;0;0;0;0;0
4600000;REMUNERACIONES Y GASTOS DEL PERSONAL;-193.577;0;0;0;-193.577
4610000;GASTOS DE ADMINISTRACIÓN;-124.109;0;0;-756;-124.865
4610100;Gastos generales de administración;-74.389;0;0;-756;-75.145
4610200;Servicios subcontratados;-33.882;0;0;0;-33.882
4610300;Gastos del Directorio;-639;0;0;0;-639
4610400;Publicidad y propaganda;-8.494;0;0;0;-8.494
4610500;Impuestos, contribuciones y aportes;-6.705;0;0;0;-6.705
4620000;DEPRECIACIONES Y AMORTIZACIONES;-38.440;0;0;0;-38.440
4630000;DETERIOROS;-39;0;0;0;-39
4650000;OTROS GASTOS OPERACIONALES;-19.851;0;0;-1;-19.852
4650100;Provisiones y gastos por bienes recibidos en pago;-9.836;0;0;0;-9.836
4650200;Provisiones por contingencias;-31;0;0;0;-31
4650201;Provisiones por riesgo país;-31;0;0;0;-31
4650211;Provisiones especiales para créditos al exterior;0;0;0;0;0
4650290;Otras provisiones por contingencias;0;0;0;0;0
4650900;Otros gastos;-9.984;0;0;-1;-9.985
4700000;RESULTADO POR INVERSIONES EN SOCIEDADES;2.995;0;0;6;3.001
4700100;Utilidades por inversiones en sociedades;2.995;0;0;6;3.001
4700101;Sucursales en el exterior;0;0;0;0;0
4700103;Sociedades con influencia significativa;2.875;0;0;0;2.875
4700110;Percibido por acciones y derechos en otras sociedades;120;0;0;6;126
4700200;Pérdidas por inversiones en sociedades;0;0;0;0;0
4700201;Sucursales en el exterior;0;0;0;0;0
4700203;Sociedades con influencia significativa;0;0;0;0;0
4700210;Ajustes por deterioro de inversiones en sociedades;0;0;0;0;0
4800000;IMPUESTO A LA RENTA;-84.584;0;0;0;-84.584
4800001;Provisión impuesto a la renta;-56.586;0;0;0;-56.586
4850000;RESULTADO DE OPERACIONES DESCONTINUADAS;0;0;0;0;0
4900000;INTERES NO CONTROLADOR;1.415;0;0;0;1.415
5003000;INGRESO NETO POR INTERESES Y REAJUSTES;383.074;315.835;2.926;-1.790;700.045
5004000;INGRESO NETO POR COMISIONES;148.030;4.761;0;1.527;154.318
5005000;TOTAL INGRESOS OPERACIONALES;588.059;324.861;8.030;-242;920.708
5006000;INGRESO OPERACIONAL NETO;432.653;324.861;8.030;-242;765.302
5007000;RESULTADO OPERACIONAL;56.637;324.861;8.030;-999;388.529
5008000;RESULTADO ANTES DE IMPUESTO A LA RENTA;59.632;324.861;8.030;-993;391.530
5009000;RESULTADO DE OPERACIONES CONTINUAS;-24.952;324.861;8.030;-993;306.946
5010000;UTILIDAD (PERDIDA) CONSOLIDADA DEL EJERCICIO;-24.952;324.861;8.030;-993;306.946
5020000;RESULTADO DE LOS PROPIETARIOS;-26.367;324.861;8.030;-993;305.531